<?xml version="1.0" encoding="UTF-8"?>
<dict:dictionarys xmlns:dict="http://www.softproject.com.pl/commons-dictionary" xmlns:xsi="http://www.w3.org/2001/XMLSchema-instance" 
xsi:schemaLocation="http://www.softproject.com.pl/commons-dictionary http://schema.softproject.com.pl/commons-dictionary/commons-dictionary.xsd">
	<dictionary name="Słownik">
		<entry key="k1">w1</entry>
			<entry key="k1.1" parent-key="k1">w1.1</entry>
				<entry key="k1.1.1" parent-key="k1.1">w1.1.1</entry>
				<entry key="k1.1.2" parent-key="k1.1">w1.1.2</entry> 
            <entry key="k1.2" parent-key="k1">w1.2</entry>               
				<entry key="k1.2.1" parent-key="k1.2">w1.2.1</entry>
		<entry key="k2">w2</entry>
	</dictionary>
	<dictionary name="Słownik2">
		<entry key="k1">w1</entry>
			<entry key="k1.1" parent-key="k1">w1.1</entry>
				<entry key="k1.1.1" parent-key="k1.1">w1.1.1</entry>
				<entry key="k1.1.2" parent-key="k1.1">w1.1.2</entry> 
            <entry key="k1.2" parent-key="k1">w1.2</entry>               
				<entry key="k1.2.1" parent-key="k1.2">w1.2.1</entry>
		<entry key="k2">w2</entry>
		
				<entry key="k1.1.3" parent-key="k1.1">w1.1.3</entry>
					<entry key="k1.1.1.1" parent-key="k1.1.2">w1.1.1.1</entry>
	</dictionary>
</dict:dictionarys>
